{
  "$schema": "https://json-schema.org/draft/2020-12/schema",
  "$id": "https://ravatex.local/governance/unit4-cutover-manifest.schema.json",
  "title": "Unit 4C documentary-authority cutover manifest",
  "type": "object",
  "additionalProperties": false,
  "required": [
    "schema_version", "manifest_id", "contract_id", "order_id", "required_parent",
    "accepted_unit4b_checkpoint", "target_branch", "allowed_remote", "cutover_id",
    "authority_epoch", "activation_status", "review_status", "second_activation",
    "original_ponr_unchanged", "state_payload_sha256",
    "activation_manifest_sha256", "current_state_file_sha256", "catalog_sha256",
    "traceability_sha256", "schema_hashes", "generated_root_hashes",
    "governing_artifact_hashes", "canonical_ledger_identity",
    "bounded_ledger_reference_identities", "rollback_readiness_sha256",
    "changed_paths", "ponr_command", "actual_activation_commit_identity",
    "unit4d_review", "prohibited_actions", "unit4c_activation_checkpoint",
    "accepted_corrected_checkpoint", "unit4d_acceptance_checkpoint",
    "original_activation_manifest_sha256", "rollback_executed"
  ],
  "properties": {
    "schema_version": { "const": "1.0.0" },
    "manifest_id": { "const": "GOVERNANCE-EFFICIENCY-REFOUNDATION-UNIT-4C-CUTOVER-MANIFEST-R1" },
    "contract_id": { "const": "GOVERNANCE-EFFICIENCY-REFOUNDATION-UNIT-4-BOOTSTRAP-AUTHORITY-CUTOVER-CONTRACT-R1" },
    "order_id": { "const": "GOVERNANCE-EFFICIENCY-REFOUNDATION-UNIT-4C-DOCUMENTARY-AUTHORITY-CUTOVER-R1" },
    "required_parent": { "const": "fa986cf935abbf053172cfd549b0171bb9446f58" },
    "accepted_unit4b_checkpoint": { "const": "fa986cf935abbf053172cfd549b0171bb9446f58" },
    "target_branch": { "const": "dev" },
    "allowed_remote": { "const": "staging/dev" },
    "cutover_id": { "const": "GOVERNANCE-EFFICIENCY-REFOUNDATION-UNIT-4C-AUTHORITY-CUTOVER-R1" },
    "authority_epoch": { "const": 1 },
    "activation_status": { "const": "active" },
    "review_status": { "const": "CLOSED / ACCEPTED / DIRECTLY VERIFIED" },
    "second_activation": { "const": false },
    "original_ponr_unchanged": { "const": true },
    "rollback_executed": { "const": false },
    "unit4c_activation_checkpoint": { "const": "51a61ddfdbf058887ead64f9b018c30ebc371b48" },
    "accepted_corrected_checkpoint": { "const": "7abaff26559c71b62337356eccd0baaf36b5f214" },
    "unit4d_acceptance_checkpoint": { "const": "7abaff26559c71b62337356eccd0baaf36b5f214" },
    "original_activation_manifest_sha256": { "type": "string", "pattern": "^[0-9a-f]{64}$" },
    "state_payload_sha256": { "type": "string", "pattern": "^[0-9a-f]{64}$" },
    "activation_manifest_sha256": { "type": "string", "pattern": "^[0-9a-f]{64}$" },
    "current_state_file_sha256": { "type": "string", "pattern": "^[0-9a-f]{64}$" },
    "catalog_sha256": { "type": "string", "pattern": "^[0-9a-f]{64}$" },
    "traceability_sha256": { "type": "string", "pattern": "^[0-9a-f]{64}$" },
    "schema_hashes": { "type": "object", "minProperties": 5 },
    "generated_root_hashes": { "type": "object", "minProperties": 4, "maxProperties": 4 },
    "governing_artifact_hashes": { "type": "object", "minProperties": 4 },
    "canonical_ledger_identity": { "type": "object", "minProperties": 3 },
    "bounded_ledger_reference_identities": { "type": "array", "minItems": 4 },
    "rollback_readiness_sha256": { "type": "string", "pattern": "^[0-9a-f]{64}$" },
    "changed_paths": { "type": "array", "minItems": 1 },
    "ponr_command": { "const": "git push staging dev" },
    "actual_activation_commit_identity": { "const": "EXTERNAL_GIT_FACT_RECORDED_AFTER_UNIT4D_ACCEPTANCE" },
    "unit4d_review": { "const": "CLOSED / ACCEPTED / DIRECTLY VERIFIED" },
    "prohibited_actions": { "type": "array", "minItems": 1 }
  }
}
