{
  "accepted_corrected_checkpoint": "7abaff26559c71b62337356eccd0baaf36b5f214",
  "accepted_unit4b_checkpoint": "fa986cf935abbf053172cfd549b0171bb9446f58",
  "activation_manifest_sha256": "990f00018b5566f39978913f7ed0b74ad6d6b3be858e44ab40e2716117978323",
  "activation_status": "active",
  "actual_activation_commit_identity": "EXTERNAL_GIT_FACT_RECORDED_AFTER_UNIT4D_ACCEPTANCE",
  "allowed_remote": "staging/dev",
  "authority_epoch": 1,
  "bounded_ledger_reference_identities": [
    {
      "end_byte": 985272,
      "end_line": 9680,
      "event_id": "GOVERNANCE-EFFICIENCY-REFOUNDATION-UNIT-4A-CUTOVER-READINESS-IMPLEMENTATION-R1",
      "heading": "## 2026-07-23 — GOVERNANCE-EFFICIENCY-REFOUNDATION-UNIT-4A-CUTOVER-READINESS-IMPLEMENTATION-R1 — implement Unit 4A candidate readiness",
      "partition_id": "G28-LEDGER-PART-0012",
      "partition_path": "docs/governance/shadow/ledger/partitions/G28_LEDGER_PART_0012.md",
      "partition_payload_sha256": "602db92e27c48275be1f9181444be0041a35ec6764646a53a56b7d9918e45cb6",
      "phase_order_id": "GOVERNANCE-EFFICIENCY-REFOUNDATION-UNIT-4A-CUTOVER-READINESS-IMPLEMENTATION-R1",
      "reason": "Unit 4A accepted readiness",
      "start_byte": 983402,
      "start_line": 9671,
      "unit_id": "G28-LEDGER-UNIT-0205",
      "unit_raw_sha256": "668cfc591e17842bb2fd26e63eec27b4da63b1418b1337d885cf7d31963aaf18"
    },
    {
      "end_byte": 987566,
      "end_line": 9690,
      "event_id": "GOVERNANCE-EFFICIENCY-REFOUNDATION-UNIT-4C-DOCUMENTARY-AUTHORITY-CUTOVER-R1",
      "heading": "## 2026-07-23 — GOVERNANCE-EFFICIENCY-REFOUNDATION-UNIT-4C-DOCUMENTARY-AUTHORITY-CUTOVER-R1 — activate structured governance authority",
      "partition_id": "G28-LEDGER-PART-0012",
      "partition_path": "docs/governance/shadow/ledger/partitions/G28_LEDGER_PART_0012.md",
      "partition_payload_sha256": "602db92e27c48275be1f9181444be0041a35ec6764646a53a56b7d9918e45cb6",
      "phase_order_id": "GOVERNANCE-EFFICIENCY-REFOUNDATION-UNIT-4C-DOCUMENTARY-AUTHORITY-CUTOVER-R1",
      "reason": "Unit 4C activation",
      "start_byte": 985272,
      "start_line": 9681,
      "unit_id": "G28-LEDGER-UNIT-0206",
      "unit_raw_sha256": "ef4734875e25c22b1922399ab17701a8e2f18c50148ac3ef1cd645fd03bb1560"
    },
    {
      "end_byte": 989067,
      "end_line": 9699,
      "event_id": "GOVERNANCE-EFFICIENCY-REFOUNDATION-UNIT-4C-CANONICAL-CONSISTENCY-FORWARD-CORRECTION-R1",
      "heading": "## 2026-07-23 — GOVERNANCE-EFFICIENCY-REFOUNDATION-UNIT-4C-CANONICAL-CONSISTENCY-FORWARD-CORRECTION-R1 — reconcile post-cutover governance authority",
      "partition_id": "G28-LEDGER-PART-0012",
      "partition_path": "docs/governance/shadow/ledger/partitions/G28_LEDGER_PART_0012.md",
      "partition_payload_sha256": "602db92e27c48275be1f9181444be0041a35ec6764646a53a56b7d9918e45cb6",
      "phase_order_id": "GOVERNANCE-EFFICIENCY-REFOUNDATION-UNIT-4C-CANONICAL-CONSISTENCY-FORWARD-CORRECTION-R1",
      "reason": "Unit 4C consistency correction",
      "start_byte": 987566,
      "start_line": 9691,
      "unit_id": "G28-LEDGER-UNIT-0207",
      "unit_raw_sha256": "19445bf9719f06f093b1cb4f4fb752c9ec2b144c74ab5fbb65a6f80039d6da8f"
    },
    {
      "end_byte": 990561,
      "end_line": 9709,
      "event_id": "GOVERNANCE-EFFICIENCY-REFOUNDATION-UNIT-4D-POST-CUTOVER-ACCEPTANCE-CLOSEOUT-R1",
      "heading": "## 2026-07-23 — GOVERNANCE-EFFICIENCY-REFOUNDATION-UNIT-4D-POST-CUTOVER-ACCEPTANCE-CLOSEOUT-R1 — docs: close Unit 4 post-cutover acceptance",
      "partition_id": "G28-LEDGER-PART-0012",
      "partition_path": "docs/governance/shadow/ledger/partitions/G28_LEDGER_PART_0012.md",
      "partition_payload_sha256": "602db92e27c48275be1f9181444be0041a35ec6764646a53a56b7d9918e45cb6",
      "phase_order_id": "GOVERNANCE-EFFICIENCY-REFOUNDATION-UNIT-4D-POST-CUTOVER-ACCEPTANCE-CLOSEOUT-R1",
      "reason": "Unit 4D acceptance",
      "start_byte": 989067,
      "start_line": 9700,
      "unit_id": "G28-LEDGER-UNIT-0208",
      "unit_raw_sha256": "174bb82d69b8fe76ad6ecce4f5f222092430eaf95506854d389b4e2a076ac2fb"
    },
    {
      "end_byte": 992811,
      "end_line": 9730,
      "event_id": "GOVERNANCE-EFFICIENCY-REFOUNDATION-UNIT-5-PRECONDITION-CANONICAL-AUTHORITY-CONSUMER-FORWARD-CORRECTION-R3",
      "heading": "## 2026-07-23 — GOVERNANCE-EFFICIENCY-REFOUNDATION-UNIT-5-PRECONDITION-CANONICAL-AUTHORITY-CONSUMER-FORWARD-CORRECTION-R3 — fix: reconcile residual governance authority consumers",
      "partition_id": "G28-LEDGER-PART-0012",
      "partition_path": "docs/governance/shadow/ledger/partitions/G28_LEDGER_PART_0012.md",
      "partition_payload_sha256": "602db92e27c48275be1f9181444be0041a35ec6764646a53a56b7d9918e45cb6",
      "phase_order_id": "GOVERNANCE-EFFICIENCY-REFOUNDATION-UNIT-5-PRECONDITION-CANONICAL-AUTHORITY-CONSUMER-FORWARD-CORRECTION-R3",
      "reason": "Unit 5 diagnosis precondition authority-consumer correction",
      "start_byte": 990561,
      "start_line": 9710,
      "unit_id": "G28-LEDGER-UNIT-0209",
      "unit_raw_sha256": "abe4cb3b8fba520f812804cb7639a0083070f26b44c4a00906c179f43e9d7f3b"
    }
  ],
  "canonical_ledger_identity": {
    "authority": "AUTHORED_APPEND_ONLY_CANONICAL_LEDGER",
    "git_object_classification": "WORKTREE_CONTENT_EXTERNAL_TO_ACTIVATION_SOURCE",
    "path": "docs/ledgers/G28_LEDGER.md",
    "sha256": "f3f3651f488e64a83e33be0310fb783181e86e57fbc1c208d0c4d03268a77613"
  },
  "catalog_sha256": "01dfaad75d303977a2fa9221ea4d2d01812ee4ec25c8ee2a23733550ec319a87",
  "changed_paths": [
    "AGENT_HANDOFF.md",
    "PROJECT_STATE.md",
    "docs/DOCUMENTATION_INDEX.md",
    "docs/architecture/CAMADA2_USUARIOS_SPEC_PROPOSED.md",
    "docs/architecture/CAMADA3_BACKUP_CONTRACT.md",
    "docs/architecture/CLAUDE_PROJECT_ASSET_MAP.md",
    "docs/architecture/DOCUMENTOS_VALIDACAO_VINCULOS_E_EVOLUCAO_PLANO.md",
    "docs/architecture/ORDEM_COMPRA_LIFECYCLE_SPEC_PROPOSED.md",
    "docs/architecture/PEDIDO_OP_MOVIMENTACAO_DOCUMENTOS_PLANO.md",
    "docs/architecture/PEDIDO_PRODUCTION_FLOW_BACKLOG.md",
    "docs/design/CAMADA2_A32_MOCKUP_APPROVED.md",
    "docs/governance/GOVERNANCE_EFFICIENCY_REFOUNDATION_PHASE_CONTRACT.md",
    "docs/governance/catalog/document-source-manifest.json",
    "docs/governance/catalog/documents.json",
    "docs/governance/current-state.json",
    "docs/governance/cutover/unit4c-cutover-manifest.json",
    "docs/governance/ledger/g28-ledger-partition-index.json",
    "docs/governance/ledger/g28-ledger-source-manifest.json",
    "docs/governance/schemas/current-state-v2.schema.json",
    "docs/governance/shadow/generated/DOCUMENTATION_INDEX.md",
    "docs/governance/shadow/generated/G28_LEDGER.md",
    "docs/governance/shadow/generated/ORDEM_COMPRA_C3_TRACEABILITY.md",
    "docs/governance/shadow/ledger/partitions/G28_LEDGER_PART_0012.md",
    "docs/ledgers/G28_LEDGER.md",
    "docs/operations/AUTH_DISABLE_USER_PROD_RELEASE_PLAN.md",
    "scripts/governance/build-unit5-precondition-correction.mjs",
    "scripts/governance/render-documentation-shadow.mjs",
    "scripts/governance/validate-canonical-authority-consumers.mjs",
    "tests/governance-canonical-authority-consumers.test.mjs",
    "tests/governance-documentation-shadow.test.mjs",
    "tests/governance-g28-ledger-shadow.test.mjs",
    "tests/governance-unit4d-acceptance-closeout.test.mjs"
  ],
  "contract_id": "GOVERNANCE-EFFICIENCY-REFOUNDATION-UNIT-4-BOOTSTRAP-AUTHORITY-CUTOVER-CONTRACT-R1",
  "current_state_file_sha256": "dd34dff5a0c3dcc92a975324318159613cb5018134e1ffc7fe971d4794279a21",
  "cutover_id": "GOVERNANCE-EFFICIENCY-REFOUNDATION-UNIT-4C-AUTHORITY-CUTOVER-R1",
  "generated_root_hashes": {
    "AGENT_HANDOFF.md": "5cb276ad4f4164d1102b008edbab9d32dacb5f2b7da6c1a86db3cef5b9ba3c6f",
    "PROJECT_STATE.md": "0a86d05cf6573dca4d5b164715fe115bc79329ac7edde6e32ad157c6f4431595",
    "docs/DOCUMENTATION_INDEX.md": "f23e9d751b4a1723cbb40d726224a7e0c0cae3e81340f900a0fb7af8999b81cc",
    "docs/architecture/ORDEM_COMPRA_C3_TRACEABILITY.md": "81e8f73f56df3cd61ce42bf0f6878ae1c7d6abb32e314a965dc07981341863b7"
  },
  "governing_artifact_hashes": {
    "docs/governance/AGENT_INSTRUCTIONS.md": "4b4715ccc3af4360bfbbbfe3458df22fb10a9d8707fad17b9cf188a450d86380",
    "docs/governance/DOCUMENTATION_MODEL.md": "2ecf212d135440e135bab188db1ebe94dedf709a4a43c0474ba3e05262981404",
    "docs/governance/GOVERNANCE_EFFICIENCY_REFOUNDATION_PHASE_CONTRACT.md": "e9376971514f27c3a811b5f547804b2abfaa6bbdb1fe0fa2c59019a7463acca8",
    "docs/governance/GOVERNANCE_EFFICIENCY_REFOUNDATION_UNIT_4_AUTHORITY_CUTOVER_CONTRACT.md": "e25f312238b717f620b12b75a921535444791e4b2121b642bb8be581f1d3c23b",
    "docs/governance/SUPERVISION_PROTOCOL.md": "0d046e279bcfa57ff1a5c6930dc24f86438d13ffc70b4bba71d7bfa77c98a8c8"
  },
  "manifest_id": "GOVERNANCE-EFFICIENCY-REFOUNDATION-UNIT-4C-CUTOVER-MANIFEST-R1",
  "order_id": "GOVERNANCE-EFFICIENCY-REFOUNDATION-UNIT-4C-DOCUMENTARY-AUTHORITY-CUTOVER-R1",
  "original_activation_manifest_sha256": "ce27f5a2471a51e47bffff09853e3fe08e63bcc6c03da0cbd2891f84c74a6f67",
  "original_ponr_unchanged": true,
  "ponr_command": "git push staging dev",
  "prohibited_actions": [
    "UNIT_5_IMPLEMENTATION",
    "RESET",
    "FORCE_PUSH",
    "HISTORY_REWRITE",
    "SILENT_FALLBACK",
    "PRODUCT_OR_DATABASE_OR_ENVIRONMENT_ACTION"
  ],
  "required_parent": "fa986cf935abbf053172cfd549b0171bb9446f58",
  "review_status": "CLOSED / ACCEPTED / DIRECTLY VERIFIED",
  "rollback_executed": false,
  "rollback_readiness_sha256": "147d6660000ab3fd43709f85f331574ba345f2b572a5bbefb95ad0ab3b10e781",
  "schema_hashes": {
    "docs/governance/schemas/current-state-v2.schema.json": "ac7f725470aaea42f01caf1479bf411b7669b23dfc4a12e1bfe095d4282262c4",
    "docs/governance/schemas/document-catalog-v2.schema.json": "00ad550d9faafadc69e4648a2fb42bf27069d499bccef9b1f893d2b5f79f1d98",
    "docs/governance/schemas/purchase-order-phase-c-v2.schema.json": "e571e89b511b7459962e0b732b322f82b87f5028bb64084a11906c01fb713dac",